title,release_date,director,duration,category,actor,resume,press_rating,spectator_rating,friend_rating
Forrest Gump,28 octobre 2015,Robert Zemeckis,2h 20min,"Comédie,Drame,Romance","Tom Hanks,Gary Sinise,Robin Wright"," Quelques décennies d'histoire américaine, des années 1940 à la fin du XXème siècle, à travers le regard et l'étrange odyssée d'un homme simple et pur, Forrest Gump.","2,6","4,6",--
La Liste de Schindler,13 mars 2019,Steven Spielberg,3h 15min,"Historique,Guerre","Liam Neeson,Ben Kingsley,Ralph Fiennes","Evocation des années de guerre d'Oskar Schindler, industriel autrichien rentré à Cracovie en 1939 avec les troupes allemandes. Il va, tout au long de la guerre, protéger des juifs en les faisant travailler dans sa fabrique.","4,2","4,6",--
La Ligne verte,,Frank Darabont,3h 09min,"Policier,Fantastique","Michael Clarke Duncan,David Morse","Paul Edgecomb, Gardien-chef du pénitencier de Cold Mountain en 1935, était chargé de veiller au bon déroulement des exécutions capitales. Parmi les prisonniers se trouvait un colosse du nom de John Coffey...","2,8","4,6",--
12 hommes en colère,25 juillet 2007,Sidney Lumet,1h 35min,Drame,"Henry Fonda,Martin Balsam,John Fiedler","Lors d'un procès, un juré émet l'hypothèse que l'homme qu'il doit juger n'est peut-être pas coupable. Il va tenter de convaincre les onze autres jurés.","5,0","4,6",--
Le Parrain,23 février 2022,Francis Ford Coppola,2h 55min,"Policier,Drame","Marlon Brando,Al Pacino,James Caan","En 1945, à New York, les Corleone sont une des cinq familles de la mafia. Don Vito Corleone marie sa fille à un bookmaker. Sollozzo, ""parrain"" de la famille Tattaglia, propose à Don Vito une association dans le trafic de drogue...","4,6","4,5",--
Les Evadés,,,2h 22min,Drame,"Tim Robbins,Morgan Freeman,Bob Gunton","Condamné à perpétuité pour le meurtre de sa femme et de son amant, un banquier s'accroche à l'espoir et se lie d'amitié avec un autre détenu pour survivre en prison.","3,2","4,5",--
Le Seigneur des anneaux : le retour du roi,,Peter Jackson,3h 21min,"Aventure,Fantastique","Sean Astin,Elijah Wood,Viggo Mortensen","Tandis que les ténèbres se répandent sur la Terre du Milieu, Aragorn se révèle être l'héritier caché des rois antiques. Quant à Frodon, toujours tenté par l'Anneau, il voyage à travers les contrées ennemies, se reposant sur Sam et Gollum...","3,8","4,5",--
Le Roi Lion,11 avril 2012,Roger Allers,1h 29min,"Aventure,Animation,Musical","Emmanuel Curtil,Matthew Broderick,Dimitri Rougeul","Le long combat de Simba le lionceau pour accéder à son rang de roi des animaux, après que le fourbe Scar, son oncle, a tué son père et pris sa place.","3,4","4,5",--
Vol au-dessus d'un nid de coucou,16 septembre 2009,Milos Forman,2h 09min,Drame,"Jack Nicholson,Louise Fletcher,William Redfield",Rebellion dans un hôpital psychiatrique à l'instigation d'un malade qui se révolte contre la dureté d'une infirmière.,"5,0","4,5",--
"The Dark Knight, Le Chevalier Noir",,Christopher Nolan,2h 32min,"Action,Thriller","Christian Bale,Heath Ledger,Aaron Eckhart",Batman entreprend de démanteler les dernières organisations criminelles de Gotham. Mais il se heurte bientôt à un nouveau génie du crime qui répand la terreur et le chaos dans la ville : le Joker...,"4,0","4,5",--
Pulp Fiction,,Quentin Tarantino,2h 29min,"Policier,Thriller","John Travolta,Samuel L. Jackson,Uma Thurman",L'odyssée sanglante et burlesque de petits malfrats dans la jungle de Hollywood à travers trois histoires qui s'entremêlent.,"4,4","4,5",--
Il était une fois dans l'Ouest,10 octobre 2018,Sergio Leone,2h 55min,Western,"Henry Fonda,Charles Bronson,Frank Wolff",Un mystérieux desperado pourchasse sans relâche un dangereux criminel.,"4,0","4,5",--
"Le Bon, la brute et le truand",5 novembre 2014,,3h 00min,Western,"Clint Eastwood,Eli Wallach,Lee Van Cleef","Pendant la Guerre de Sécession, Tuco, Joe et Setenza, trois hommes préférant s'intéresser à leur profit personnel, se lancent à la recherche d'un coffre contenant 200 000 dollars en pièces d'or volés à l'armée sudiste. Chacun a besoin de l'autre...","4,1","4,5",--
Il était une fois en Amérique,6 mai 2015,,3h 40min,"Policier,Drame","Robert De Niro,James Woods,Elizabeth McGovern","Il était une fois deux truands juifs, Max et Noodles, liés par un pacte d'éternelle amitié. Débutant au début du siècle par de fructueux trafics dans le ghetto de New York, ils voient leurs chemins se séparer, lorsque Noodles se retrouve durant quelques années derrière les barreaux, puis se recouper en pleine période de prohibition, dans les années vingt. Jusqu'au jour où la trahison les sépare à nouveau.","4,9","4,5",--
Django Unchained,,,2h 44min,Western,"Jamie Foxx,Christoph Waltz,Leonardo DiCaprio",Le parcours d'un chasseur de prime allemand et d'un homme noir pour retrouver la femme de ce dernier retenue en esclavage par le propriétaire d'une plantation...,"4,6","4,5",--
Le Seigneur des anneaux : la communauté de l'anneau,,Peter Jackson,2h 58min,"Aventure,Fantastique","Elijah Wood,Sean Astin,Ian McKellen","Frodon le Hobbit hérite de l'Anneau Unique, un instrument de pouvoir absolu qui permettrait à Sauron, le Seigneur des ténèbres, de régner sur la Terre du Milieu. Commence alors un vaste périple visant à la destruction de l'objet.","3,7","4,5",--
Gladiator,,Ridley Scott,2h 35min,"Action,Aventure","Russell Crowe,Joaquin Phoenix,Connie Nielsen","Le général romain Maximus est le plus fidèle soutien de l'empereur Marc Aurèle, qu'il a conduit de victoire en victoire avec une bravoure et un dévouement exemplaires. Jaloux du prestige de Maximus, et plus encore de l'amour que lui voue l'empereur, le fils de MarcAurèle, Commode, s'arroge brutalement le pouvoir, puis ordonne l'arrestation du ...","4,3","4,5",--
Gran Torino,,,1h 56min,"Drame,Thriller","Bee Vang,Ahney Her","Walt Kowalski est un ancien de la guerre de Corée, un homme inflexible, amer et pétri de préjugés surannés. Hormis sa chienne Daisy, il ne fait confiance qu'à son M-1, toujours propre, toujours prêt à l'usage...","4,7","4,5",--
Le Seigneur des anneaux : les deux tours,,,2h 59min,"Aventure,Fantastique",Viggo Mortensen,"Frodon Sacquet, le Hobbit, doit braver de terribles dangers pour tenter de détruire l'Anneau Unique, convoité par Sauron, le Seigneur des ténèbres. De leur côté, Gimli, Legolas et Aragorn doivent sauver Pippin et Merry, capturés par les Orques...","4,0","4,5",--
Interstellar,,Christopher Nolan,2h 49min,"Drame,Science Fiction","Matthew McConaughey,Anne Hathaway,Michael Caine",Le film raconte les aventures d’un groupe d’explorateurs qui utilisent une faille récemment découverte dans l’espace-temps afin de repousser les limites humaines et partir à la conquête des distances astronomiques dans un voyage interstellaire. ,"3,8","4,5",--
Star Wars : Episode V - L'Empire contre-attaque,9 avril 1997,Irvin Kershner,2h 04min,"Aventure,Science Fiction","Mark Hamill,Harrison Ford,Carrie Fisher","Malgré la destruction de l'Etoile Noire, l'Empire maintient son emprise sur la galaxie, et poursuit sans relâche sa lutte contre l'Alliance rebelle. Basés sur la planète glacée de Hoth, les rebelles essuient un assaut des troupes impériales...","5,0","4,5",--
Seven,,David Fincher,2h 10min,"Policier,Thriller","Brad Pitt,Morgan Freeman,Gwyneth Paltrow",John Doe a decidé de nettoyer la societé des maux qui la rongent en commettant sept meurtres bases sur les sept pechés capitaux.,"3,6","4,5",--
Le Dictateur,10 juillet 2019,Charles Chaplin,2h 05min,Comédie,"Jack Oakie,Paulette Goddard","Dans le ghetto juif vit un petit barbier qui ressemble énormément à Adenoid Hynkel, le dictateur de Tomania qui a décidé l’extermination du peuple juif. Au cours d’une rafle, le barbier est arrêté en compagnie de Schultz, un farouche adversaire d’Hynkel...","5,0","4,5",--
Coco,,Lee Unkrich,1h 45min,"Animation,Famille,Fantastique","Andrea Santamaria,Anthony Gonzalez (VIII),Benjamin Bratt","Depuis déjà plusieurs générations, la musique est bannie dans la famille de Miguel. Un vrai déchirement pour le jeune garçon dont le rêve ultime est de devenir un musicien aussi accompli que son idole, Ernesto de la Cruz. ","4,1","4,5",--
Your Name,,Makoto Shinkai,1h 50min,"Animation,Fantastique","Yoann Borg,Ryûnosuke Kamiki,Alice Orsat","Mitsuha, adolescente coincée dans une famille traditionnelle, rêve de quitter ses montagnes natales pour découvrir la vie trépidante de Tokyo. Elle est loin d’imaginer pouvoir vivre l’aventure urbaine dans la peau de… Taki, un jeune lycéen vivant à Tokyo, occupé entre son petit boulot dans un restaurant italien et ses nombreux amis.","4,0","4,5",--
Parasite,,Bong Joon Ho,2h 12min,Thriller,"Song Kang-Ho,Woo-sik Choi,Park So-Dam","Toute la famille de Ki-taek est au chômage, et s’intéresse fortement au train de vie de la richissime famille Park. Un jour, leur fils réussit à se faire recommander pour donner des cours particuliers d’anglais chez les Park. C’est le début d’un engrenage incontrôlable...","4,8","4,5",--
Les Affranchis,,Martin Scorsese,2h 25min,"Drame,Thriller","Ray Liotta,Robert De Niro,Joe Pesci","Depuis sa plus tendre enfance, Henry Hill, né d'un père irlandais et d'une mère sicilienne, veut devenir gangster et appartenir à la Mafia. Adolescent dans les années cinquante, il commence par travailler pour le compte de Paul Cicero...","5,0","4,5",--
Fight Club,15 mai 2019,,2h 19min,"Drame,Thriller","Edward Norton,Helena Bonham Carter","Le narrateur, vit seul, travaille seul, dort seul, comme beaucoup d'autres personnes seules qui connaissent la misère morale et sexuelle. C'est pourquoi il va devenir membre du Fight club, un lieu clandestin dirigé par Tyler Durden, anarchiste entre gourou et philosophe.","2,7","4,5",--
"Le Parrain, 2e partie",18 septembre 2013,Francis Ford Coppola,3h 20min,"Policier,Drame","Kathleen Beller,Ignazio Pappalardo,Roman Coppola","Depuis la mort de Don Vito Corleone, son fils Michael règne sur la famille. Amené à négocier avec la mafia juive, il perd le soutien de son lieutenant Frankie Pentageli. Echappant de justesse à un attentat, Michael tente de retrouver le coupable...","4,7","4,5",--
Green Book : Sur les routes du sud,,Peter Farrelly,2h 10min,"Biopic,Drame","Viggo Mortensen,Mahershala Ali,Linda Cardellini","En 1962, alors que règne la ségrégation, Tony Lip, un videur italo-américain du Bronx, est engagé pour conduire et protéger le Dr Don Shirley, un pianiste noir de renommée mondiale, lors d’une tournée de concerts.","4,0","4,5",--
Inception,12 août 2020,Christopher Nolan,2h 28min,"Science Fiction,Thriller","Leonardo DiCaprio,Marion Cotillard,Elliot Page","Au lieu de subtiliser un rêve, un voleur expérimenté et son équipe doivent faire l'inverse : implanter une idée dans l'esprit d'un individu. S'ils y parviennent, il pourrait s'agir du crime parfait ...","4,1","4,5",--
Retour vers le futur,,Robert Zemeckis,1h 56min,"Aventure,Comédie,Science Fiction","Michael J. Fox,Christopher Lloyd,Lea Thompson","Après être arrivé en 1955 à bord d'une DeLorean convertie en machine à remonter le temps, Marty McFly fonce pour s'assurer que ses futurs parents tombent amoureux.","3,6","4,5",--
La Vie est belle,,Roberto Benigni,1h 57min,"Comédie,Drame","Horst Buchholz,Marisa Paredes","En 1938, Guido, jeune homme plein de gaieté, rêve d'ouvrir une librairie, malgré les tracasseries de l'administration fasciste. Il tombe amoureux de Dora, institutrice étouffée par le conformisme familial et l'enlève le jour de ses fiançailles avec un bureaucrate du régime. Cinq ans plus tard, Guido et Dora ont un fils: Giosue. Mais les ...","3,7","4,4",--
Usual Suspects,18 juillet 2001,Bryan Singer,1h 46min,"Policier,Thriller","Chazz Palminteri,Kevin Spacey,Gabriel Byrne","Suite à une mystérieuse dénonciation, cinq criminels se retrouvent en garde à vue. Plus tard, engagés sur un coup par le génie du crime Keyser Söze, les cinq hommes sont pris au piège d’une diabolique machination…","4,6","4,4",--
Les Temps modernes,10 juillet 2019,Charles Chaplin,1h 27min,"Comédie dramatique,Romance","Paulette Goddard,Henry Bergman","Charlot est ouvrier dans une immense usine. Il resserre quotidiennement des boulons. Mais les machines, le travail à la chaîne le rendent malade, il abandonne son poste et recueille une orpheline…","4,6","4,4",--
Le Kid,10 juillet 2019,,0h 52min,Comédie,"Jackie Coogan,Edna Purviance","Lâchée par son amant, une jeune femme abandonne son enfant. Charlot le vagabond le recueille. Mais les services sociaux s’en mêlent...","4,0","4,4",--
Le Tombeau des lucioles,,Isao Takahata,1h 30min,"Animation,Drame,Guerre","J. Robert Spencer,Ayano Shiraishi,Veronica Taylor","Japon, été 1945. Après le bombardement de Kobé, Seita, un adolescent de quatorze ans et sa petite soeur de quatre ans, Setsuko, orphelins, vont s'installer chez leur tante à quelques dizaines de kilomètres de chez eux. Celle-ci leur fait comprendre qu'ils sont une gêne pour la famille et doivent mériter leur riz quotidien. Seita décide de ...","4,0","4,4",--
Whiplash,,Damien Chazelle,1h 47min,"Drame,Musical","Miles Teller,J.K. Simmons,Paul Reiser","Andrew, 19 ans, rêve de devenir l’un des meilleurs batteurs de jazz de sa génération. Mais la concurrence est rude au conservatoire de Manhattan où il s’entraîne avec acharnement...","4,1","4,4",--
American History X,,Tony Kaye,1h 59min,Drame,"Edward Norton,Edward Furlong,Elliott Gould","Derek veut venger la mort de son père, abattu par un dealer noir, et épouse les thèses racistes d'un groupuscule de militants d'extrême droite. Ces théories le mèneront à commettre un double meurtre...","2,8","4,4",--
Psychose,6 avril 2022,Alfred Hitchcock,1h 49min,"Epouvante-horreur,Thriller","Anthony Perkins,Janet Leigh,John Gavin",Une jeune femme en fuite trouve refuge dans un motel isolé...,"4,5","4,4",--
Le Silence des agneaux,7 octobre 2020,Jonathan Demme,1h 58min,"Drame,Thriller","Anthony Hopkins,Jodie Foster,Scott Glenn","Clarice Starling, jeune stagiaire du FBI, est désignée pour enquêter sur une série de meurtres épouvantables commis dans le Middle West par un tueur de femmes psychopathe connu sous le nom de Buffalo Bill.","4,8","4,4",--
Star Wars : Episode IV - Un nouvel espoir (La Guerre des étoiles),12 mars 1997,George Lucas,2h 01min,"Aventure,Science Fiction","Mark Hamill,Harrison Ford,Carrie Fisher","Il y a bien longtemps, dans une galaxie très lointaine... La guerre civile fait rage entre l'Empire galactique et l'Alliance rebelle.","4,8","4,4",--
Joker,,Todd Phillips,2h 02min,Drame,"Joaquin Phoenix,Robert De Niro,Zazie Beetz","Le film, qui relate une histoire originale inédite sur grand écran, se focalise sur la figure emblématique de l’ennemi juré de Batman. Il brosse le portrait d’Arthur Fleck, un homme sans concession méprisé par la société.","4,1","4,4",--
L'Intendant Sansho,31 juillet 2019,Kenji Mizoguchi,2h 04min,Drame,"Kinuyo Tanaka,Yoshiaki Hanayagi,Kyôko Kagawa","XIe siècle. Un gouverneur de province est exilé pour avoir pris le parti des paysans contre l’avis d’un chef militaire. Contraints de reprendre la route de son village natal, sa femme Nakagimi et ses enfants Anju et Zushio sont kidnappés par des bandits de grand chemin...","5,0","4,4",--
Star Wars : Episode VI - Le Retour du Jedi,23 avril 1997,Richard Marquand,2h 13min,"Aventure,Science Fiction","Kinuyo Tanaka,Yoshiaki Hanayagi,Kyôko Kagawa","L'Empire galactique est plus puissant que jamais : la construction de la nouvelle arme, l'Etoile de la Mort, menace l'univers tout entier...","3,0","4,4",--
Lion,,Garth Davis,1h 58min,"Biopic,Drame","Dev Patel,Rooney Mara,Nicole Kidman","Une incroyable histoire vraie :  à 5 ans, Saroo se retrouve seul dans un train traversant l’Inde qui l’emmène malgré lui à des milliers de kilomètres de sa famille. Perdu, le petit garçon doit apprendre à survivre seul dans l’immense ville de Calcutta.","3,1","4,4",--
Hamilton,,Thomas Kail,2h 40min,"Biopic,Historique,Musical","Lin-Manuel Miranda,Jonathan Groff (II),Daveed Diggs","Captation de la célèbre comédie musicale de Broadway récompensée par 11 Tony, Grammy et Olivier Awards, et par un prix Pulitzer. Hamilton raconte l'histoire d'Alexander Hamilton, l'un des Pères fondateurs de la nation américaine.",,"4,4",
Million Dollar Baby,,Clint Eastwood,2h 12min,Drame,"Morgan Freeman,Hilary Swank","Replié sur lui-même, l'entraîneur Frankie Dunn vit dans un désert affectif, en évitant toute relation qui pourrait accroître sa douleur et sa culpabilité. Un jour, une trentenaire pousse la porte de son gymnase à la recherche d'un coach...","4,9","4,4",--
Tu ne tueras point,,Mel Gibson,2h 20min,"Biopic,Drame,Guerre","Andrew Garfield,Vince Vaughn,Teresa Palmer","1945, alors que la guerre dans le Pacifique fait rage et que les forces américaines mènent l’une des batailles les plus acharnées du conflit sur l’île d’Okinawa, un soldat s’est distingué. Fidèle à ses convictions et armé de son seul courage, il a sauvé la vie de dizaines de soldats blessés.","3,0","4,4",--
Les Lumières de la ville,10 juillet 2019,Charles Chaplin,1h 27min,"Comédie dramatique,Romance","Virginia Cherrill,Harry Myers","Un vagabond s’éprend d’une belle et jeune vendeuse de fleurs aveugle qui vit avec sa mère, couverte de dettes. Suite à un quiproquo, la fleuriste s’imagine le misérable, qui vient de lui acheter une fleur, en milliardaire...","4,5","4,4",--
"Les Enfants Loups, Ame & Yuki",,Mamoru Hosoda,1h 57min,"Animation,Fantastique","Kumiko Aso,Megumi Hayashibara,Takuma Hiraoka","Hana et ses deux enfants, Ame et Yuki, vivent discrètement dans un coin tranquille de la ville. Leur vie est simple et joyeuse, mais ils cachent un secret : leur père est un homme-loup. Quand celui-ci disparaît brutalement, Hana décide de quitter la ville pour élever ses enfants...","4,1","4,4",--
Voyage au bout de l'enfer,25 juillet 2018,Michael Cimino,3h 03min,"Drame,Guerre","Robert De Niro,Christopher Walken,Meryl Streep","Cinq ouvriers sidérurgistes affrontent les hauts fourneaux d'une petite ville de Pennsylvannie et partent ensemble chasser le cerf. Parce que c'est la guerre au Vietnam, trois d'entre eux deviennent soldats sur le départ...","4,7","4,4",--
Apocalypse Now Final Cut,21 août 2019,Francis Ford Coppola,3h 02min,"Drame,Guerre","Martin Sheen,Frederic Forrest,Robert Duvall","Cloîtré dans une chambre d'hôtel de Saïgon, le jeune capitaine Willard, mal rasé et imbibé d'alcool, est sorti de sa prostration par une convocation de l'état-major américain. Le général Corman lui confie une mission qui doit rester secrète : éliminer le colonel Kurtz, un militaire aux méthodes quelque peu expéditives...","4,8","4,4",--
Le Voyage de Chihiro,,Hayao Miyazaki,2h 05min,"Aventure,Animation","Rumi Hiiragi,Miyu Irino,Mari Natsuki","Chihiro, une fillette de 10 ans, est en route vers sa nouvelle demeure en compagnie de ses parents. Au cours du voyage, la famille fait une halte dans un parc à thème qui leur paraît délabré. Lors de la visite, les parents s’arrêtent dans un des bâtiments pour déguster quelques mets très appétissants, apparus comme par enchantement. Hélas cette nourriture les transforme en porcs. Prise de panique, Chihiro s’enfuit et se retrouve seule dans cet univers fantasmagorique ; elle rencontre alors l’énigmatique Haku, son seul allié dans cette terrible épreuve...","4,8","4,4",--
Les Sentiers de la gloire,23 mars 2011,Stanley Kubrick,1h 28min,"Drame,Guerre","Kirk Douglas,Ralph Meeker,Adolphe Menjou","Durant la Première Guerre mondiale, le général français Mireau lance une offensive suicidaire contre une position allemande imprenable. Au moment de l'attaque, les soldats tombent par dizaines et leurs compagnons refusent d'avancer...","4,6","4,4",--
Intouchables,,Eric Toledano,1h 52min,Drame,"François Cluzet,Omar Sy,Anne Le Ny","La rencontre improbable, touchante et drôle entre un riche aristocrate, tétraplégique depuis un accident de parapente, et un jeune de banlieue engagé par hasard pour être son aide à domicile...","3,7","4,4",--
Indiana Jones et la Dernière Croisade,,Steven Spielberg,2h 07min,"Action,Aventure","Harrison Ford,Sean Connery,Denholm Elliott","L'archéologue aventurier Indiana Jones se retrouve aux prises avec un maléfique milliardaire. Aux côtés de la cupide Elsa et de son père, il part à la recherche du Graal.","4,4","4,4",--
Le Pianiste,,Roman Polanski,2h 28min,"Drame,Historique","Adrien Brody,Thomas Kretschmann,Emilia Fox","Durant la Seconde Guerre mondiale, Wladyslaw Szpilman, un pianiste juif polonais, est interné dans le ghetto de Varsovie dont il partage les souffrances, les humiliations et les luttes héroïques. Un officier allemand l'aide et lui permet de survivre.","4,1","4,4",--
Spider-Man : New Generation,,Bob Persichetti,1h 57min,"Action,Animation,Famille","Stéphane Bak,Shameik Moore,Jake Johnson (XVI)","SPIDER-MAN : NEW GENERATION présente Miles Morales, un adolescent vivant à Brooklyn, et révèle les possibilités illimitées du Spider-Verse, un univers où plus d’un peut porter le masque…","4,2","4,4",--
Princesse Mononoké,,,2h 15min,"Animation,Drame","Gillian Anderson,Claire Danes,Pamela Adlon","Japon, XVe siècle. Jadis protégée par des animaux géants, la forêt se dépeuple à cause de l'homme. Blessé par un sanglier rendu fou par les démons, le jeune guerrier Ashitaka quitte les siens et part à la recherche du dieu-cerf qui seul pourra défaire le sortilège qui lui gangrène le bras. Au cours de son voyage, Ashitaka rencontre Lady Eboshi, à la tête d’une communauté de forgerons, qui doit se défendre contre ceux qui lui reprochent de détruire la forêt pour alimenter ses forges. Parmi ses pires ennemis se trouve San, une jeune fille sauvage élevée par des loups, aussi appelée ""Princesse Mononoké"", la princesse des spectres...","4,8","4,4",--
Ip Man,,Wilson Yip,1h 45min,"Biopic,Arts Martiaux","Donnie Yen,Simon Yam,Siu-Wong Fan","Film biographique sur la vie de Ip Man, pionnier du Wing Chun et maitre de Bruce Lee.",,"4,4",
Il faut sauver le soldat Ryan,,Steven Spielberg,2h 43min,"Drame,Guerre","Ryan Hurst,Tom Hanks,Tom Sizemore","Alors que les forces alliées débarquent à Omaha Beach, Miller doit conduire son escouade derrière les lignes ennemies pour une mission particulièrement dangereuse : trouver et ramener sain et sauf le simple soldat James Ryan, dont les trois frères sont morts au combat en l'espace de trois jours. Pendant que l'escouade progresse en territoire ...","3,0","4,4",--
Top Gun: Maverick,,Joseph Kosinski,2h 11min,Action,"Tom Cruise,Miles Teller,Jennifer Connelly","Après avoir été l’un des meilleurs pilotes de chasse de la Marine américaine, Pete “Maverick"" Mitchell continue à repousser ses limites en tant que pilote d'essai. Il est chargé de former un détachement de jeunes diplômés de l’école Top Gun pour une mission spéciale qu’aucun pilote n'aurait jamais imaginée.","3,7","4,4",--
Les Aventuriers de l'Arche perdue,,,1h 56min,"Action,Aventure","Harrison Ford,Karen Allen,Paul Freeman","1936. L'aventurier Indiana Jones est mandaté pour mettre la main sur le médaillon de Râ, qui serait le premier pas sur le chemin de l'Arche d'Alliance, celle-là même où Moïse conserva les Dix Commandements. Une pièce dont Hitler cherche aussi à s'emparer.","4,6","4,4",--
Matrix,,Lana Wachowski,2h 15min,"Action,Science Fiction","Keanu Reeves,Laurence Fishburne,Carrie-Anne Moss","Programmeur anonyme, Thomas Anderson est aussi l'un des pirates les plus recherchés du cyber-space. Il est contacté par un certain Morpheus. Ensemble, ils se lancent dans une lutte sans retour contre la Matrice et ses terribles agents...","3,4","4,4",--
"Alien, le huitième passager",12 novembre 2003,Ridley Scott,1h 56min,"Epouvante-horreur,Science Fiction","Sigourney Weaver,Tom Skerritt,Veronica Cartwright","Le vaisseau Nostromo et son équipage rentrent sur Terre avec une cargaison de minerai. Mais lors d'un arrêt forcé sur une planète déserte, l'officier Kane se fait agresser par une forme de vie inconnue, une arachnide qui étouffe son visage...","4,4","4,4",--
Toy Story 3,,Lee Unkrich,1h 40min,"Aventure,Animation,Comédie","Jean-Philippe Puymartin,Richard Darbois","Woody le cowboy, Buzz l'Eclair et les autres jouets se retrouvent confrontés à ce qui devait bien arriver un jour : le départ d'Andy pour l'université...","4,7","4,4",--
Le Conte de la princesse Kaguya,,Isao Takahata,2h 17min,"Animation,Drame,Famille","Aki Asakura,Kengo Kora,Takeo Chii","Kaguya, « la princesse lumineuse », est un petit être découvert dans la tige d’un bambou par un vieux paysan. La considérant comme un don du ciel, il l’élève avec sa femme, et très vite l’enfant devient une magnifique jeune fille. De la campagne lointaine jusqu’à la grande capitale, sa fascinante beauté suscitera l’engouement auprès de tous ceux qui la rencontrent et elle sera convoitée par cinq nobles princes qui devront relever d’impossibles défis dans l’espoir d’obtenir sa main. Mais le temps venu, elle devra affronter son destin…","4,5","4,4",--
Fenêtre sur cour,22 octobre 2008,Alfred Hitchcock,1h 50min,"Policier,Thriller","James Stewart,Grace Kelly,Wendell Corey",Un reporter immobilisé par un plâtre observe de sa fenêtre les allées et venues de ses voisins. Le comportement bizarre d'un représentant de commerce l'intrigue à un point tel qu'il le croit meurtrier de sa femme. Fantasme ou réalité ?,"3,9","4,4",--
