title,release_date,director,duration,category,actor,resume,press_rating,spectator_rating,friend_rating
J'ai rencontré le Diable,,Kim Jee-Woon,2h 22min,"Drame,Thriller","Lee Byung-Hun,Choi Min-sik,Oh San-ha",Un agent secret recherche le serial killer qui a tué sa fiancée...,"4,2","4,3",--
Rendez-vous,22 septembre 2010,Ernst Lubitsch,1h 37min,"Comédie,Romance","Margaret Sullavan,James Stewart,Frank Morgan","Chez Matuschek et Cie, une grande boutique de maroquinerie, le jeune Alfred Kralik, l'adjoint du patron, et Klara Novak, une nouvelle employée, vont échanger une correspondance amoureuse, sans savoir qui ils sont, à l'aide de petites annonces.","4,0","4,3",--
Les Diaboliques,8 novembre 2017,Henri-Georges Clouzot,1h 57min,"Drame,Epouvante-horreur,Thriller","Noël Roquevert,Simone Signoret,Vera Clouzot","Dans une institution destinée à l'éducation des jeunes garçons, Christina et Nicole, respectivement épouse et maîtresse du directeur Michel Delasalle, s'associent afin d'assassiner l'homme qu'ells ont fini par haïr. Mais quelques jours après leur méfait, le corps de Michel disparaît...",,"4,3",
Violet Evergarden - le film,,Taichi Ishidate,2h 21min,"Animation,Drame,Fantastique","Yui Ishikawa,Daisuke Namikawa,Takehito Koyasu","Violet Evergarden est toujours incapable d'oublier Gilbert, son ancien supérieur hiérarchique. Un jour, alors qu'elle reçoit une demande d'un jeune client, CH Postal découvre une lettre sans adresse dans leur entrepôt.","2,7","4,3",--
Rain Man,,Barry Levinson,2h 13min,Comédie dramatique,"Dustin Hoffman,Tom Cruise,Valeria Golino","A la mort de son père, Charlie Babbitt, homme d'affaires pressé, hérite d'une vieille Buick qu'il convoitait depuis longtemps mais se voit spolié de quelque trois millions de francs versés à l'Institution psychiatrique Wallbrook au profit d'un bénéficiaire anonyme. Charlie se rend a Wallbrook et découvre l'heureux bénéficiaire. Il s'agit ...","3,6","4,3",--
Je veux manger ton pancréas,,Shin'ichirô Ushijima,1h 48min,"Animation,Drame,Romance","Mahiro Takasugi, Lynn,Yukiyo Fujii","Sakura est une lycéenne populaire et pleine de vie. Tout l’opposé d'un de ses camarades solitaires qui, tombant par mégarde sur son journal intime, découvre qu’elle n’a plus que quelques mois à vivre... Unis par ce secret, ils se rapprochent et s'apprivoisent.",,"4,3",
Panique,30 mars 2016,Julien Duvivier,1h 31min,"Policier,Drame","Michel Simon,Viviane Romance,Lucas Gridoux","Monsieur Hire est un homme que les villageois jugent comme bizarre et presque inquiétant. Lorsqu'un crime est commis, le vrai coupable cherche donc à faire porter le chapeau à ce coupable idéal.",,"4,3",
The Normal Heart,,Ryan Murphy,2h 12min,Drame,"Mark Ruffalo,Julia Roberts,Matt Bomer","Une adaptation de la pièce The Normal Heart, qui décrit la montée en puissance du virus du sida dans les années 80 et le combat d'un écrivain-activiste, Ned Weeks, fondateur d'un groupe d'aide luttant contre la maladie.",,"4,3",
Klaus,,Sergio Pablos,1h 36min,Animation,"Alex Lutz,Jason Schwartzman,Ludivine Sagnier",Un jeune facteur affecté à une sinistre petite ville glacée du pôle Nord découvre que le père Noël s'y cache.,"4,2","4,3",--
Papillon,,Franklin J. Schaffner,2h 25min,"Aventure,Biopic,Drame","Steve McQueen,Victor Jory","Henri ""Papillon"" Charrière, un malfrat de petite envergure, est jugé à tort pour un meurtre qu'il n'a pas commis. Celui-ci est condamné à vie dans une prison d'une colonie française : le bagne de Cayenne.","4,0","4,3",--
Printemps tardif,31 juillet 2019,Yasujirô Ozu,1h 48min,Drame,"Chishû Ryû,Setsuko Hara,Yumeji Tsukioka","Noriko, une jeune femme âgée d’une vingtaine d’années, vit avec son père veuf, Shukichi. Alors que Noriko s'apprête à s'installer seule, père et fille décident de faire un dernier voyage ensemble…",,"4,3",
Le Temps d'aimer et le temps de mourir,14 août 2019,Douglas Sirk,2h 13min,"Drame,Historique,Guerre","John Gavin,Liselotte Pulver,Jock Mahoney","1944. Alors qu'il revient dans sa ville natale pour une permission, Ernst Graeber, jeune soldat allemand envoyé sur le front russe, rencontre Elisabeth Kruse, dont il tombe amoureux. Mais la guerre qui continue va bouleverser leur histoire...","4,7","4,3",--
Divorce à l'Italienne,15 mai 2019,Pietro Germi,1h 44min,"Comédie,Drame,Romance","Marcello Mastroianni,Daniela Rocca,Stefania Sandrelli","Ferdinando Cefalu, un noble sicilien, est amoureux de sa jeune cousine, Angela. Mais il est marié à Rosalia, une femme insupportable, et le divorce est illégal en Italie... Plein de ressources, Ferdinando concocte donc un "" divorce à l'italienne "" : pousser sa femme dans les bras d'un amant.","4,0","4,3",--
Slumdog Millionaire,,Loveleen Tandan,2h 00min,"Comédie,Comédie dramatique,Romance","Dev Patel,Freida Pinto,Mia Drake"," Le récit pittoresque d'un jeune homme issu des bidonvilles de Mumbai en passe de gagner le jeu télévisé ""Qui veut gagner des millions"".","3,5","4,3",--
Sur la route de Madison,,Clint Eastwood,2h 15min,"Drame,Romance","Meryl Streep,Annie Corley","Michael Johnson et sa soeur Caroline reviennent dans la ferme de leur enfance régler la succession de leur mère, Francesca. Ils vont découvrir tout un pan de la vie de leur mère ignoré de tous, sa brève, intense et inoubliable liaison avec un photographe de passage.","4,6","4,3",--
Midnight Express,,Alan Parker,2h 00min,Drame,"Brad Davis,Irene Miracle,Bo Hopkins","Billy Hayes est arrêté à Istanbul pour avoir sur lui quelques grammes de hashisch. Condamné à perpétuité, il est enfermé dans des geôles d'une extrême inhumanité.","2,0","4,3",--
Soy Cuba,20 octobre 2021,Mikhail Kalatozov,2h 21min,Drame,"Luz Maria Collazo,José Gallardo,Raul Garcia (III)","A travers quatre histoires qui renforcent l'idéal communiste face à la mainmise du capitalisme, ""Soy Cuba"" dépeint la lente évolution de Cuba du régime de Batista jusqu'à la révolution castriste.","4,1","4,2",--
Un Condamné à mort s'est échappé,5 septembre 2018,Robert Bresson,1h 39min,Drame,"François Leterrier,Charles Le Clainche,Maurice Beerblock","Conduit en 1943 au fort de Montluc pour y être exécuté par les Allemands, le lieutenant Fontaine parvient à s'échapper en compagnie d'un autre prisonnier, Jost.",,"4,2",
Impitoyable,21 juin 2017,,2h 11min,"Drame,Western","Gene Hackman,Morgan Freeman","Kansas 1880. William Munny, redoutable hors-la-loi reconverti dans l'élevage va, à la demande d'un jeune tueur, reprendre du service pour venger une prostituée défigurée par un cow-boy sadique.","4,8","4,2",--
Silent Voice,,Naoko Yamada, 2h 09min,"Animation,Drame,Romance","Miyu Irino,Saori Hayami,Aoi Yūki","Nishimiya est une élève douce et attentionnée. Chaque jour, pourtant, elle est harcelée par Ishida, car elle est sourde. Dénoncé pour son comportement, le garçon est à son tour mis à l'écart et rejeté par ses camarades. Des années plus tard, il apprend la langue des signes... et part à la recherche de la jeune fille. ","3,7","4,2",--
Soul,,Pete Docter,1h 40min,"Aventure,Animation,Famille","Omar Sy,Jamie Foxx,Camille Cottin","Au moment où Joe pense que son rêve est désormais à portée de main, un pas malencontreux l’expédie dans un endroit fantastique où il est obligé de réfléchir à nouveau à la signification d’avoir une âme. C’est là qu’il se lie d’amitié avec 22, une âme qui ne pense pas que la vie sur Terre soit aussi bien que ce qu’on veut bien lui faire croire...","4,3","4,2",--
Certains l'aiment chaud,16 janvier 2019,Billy Wilder,2h 01min,"Comédie,Romance","Marilyn Monroe,Tony Curtis,Jack Lemmon","Deux musiciens de jazz au chômage, mêlés involontairement à un règlement de comptes entre gangsters, se transforment en musiciennes pour leur échapper. Ils partent en Floride avec un orchestre féminin. Ils tombent amoureux d'une ravissante créature.","3,2","4,2",--
Gentleman Jim,4 octobre 2006,Raoul Walsh,1h 44min,Drame,"Errol Flynn,Alexis Smith,Jack Carson","Comment, dans les années 1880, le jeune Jim Corbett va devenir Gentleman Jim et donner à la boxe ses lettres de noblesse.",,"4,2",
Une merveilleuse histoire du temps,,James Marsh,2h 03min,"Biopic,Drame","Eddie Redmayne,Felicity Jones,Tom Prior","1963, en Angleterre, Stephen, brillant étudiant en Cosmologie à l’Université de Cambridge, entend bien donner une réponse simple et efficace au mystère de la création de l’univers. De nouveaux horizons s’ouvrent quand il tombe amoureux d’une étudiante en art, Jane Wilde.","3,3","4,2",--
Lawrence d'Arabie,24 avril 2013,David Lean,3h 36min,"Aventure,Biopic","Peter O'Toole,Alec Guinness,Omar Sharif","Le destin hors du commun de l'officier britannique T. E. Lawrence, qui mena la révolte arabe contre l'occupant turc au cours de la Première Guerre mondiale. Adapté des Sept Piliers de la sagesse, son récit autobiographique.","4,4","4,2",--
Star Wars : Episode III - La Revanche des Sith,,George Lucas,2h 20min,"Action,Aventure,Science Fiction","Hayden Christensen,Ewan McGregor,Natalie Portman","La Guerre des Clones fait rage. Une franche hostilité oppose désormais le Chancelier Palpatine au Conseil Jedi. Anakin Skywalker, jeune Chevalier Jedi pris entre deux feux, hésite sur la conduite à tenir...","3,9","4,2",--
Dragons 3 : Le monde caché,,Dean DeBlois,1h 44min,"Aventure,Animation,Famille","Donald Reignoux,Jay Baruchel,Florine Orphelin","Harold est maintenant le chef de Berk au côté d’Astrid et Krokmou, en tant que dragon, est devenu le leader de son espèce. Ils réalisent enfin leurs rêves de vivre en paix entre vikings et dragons. Mais lorsque l’apparition soudaine d’une Furie Eclair coïncide avec la plus grande menace que le village n’ait jamais connue, Harold et Krokmou sont forcés de quitter leur village pour un voyage dans un monde caché...","3,9","4,2",--
Pupille,,Jeanne Herry,1h 50min,Drame,"Sandrine Kiberlain,Gilles Lellouche,Élodie Bouchez",Théo est remis à l'adoption par sa mère biologique le jour de sa naissance. C'est un accouchement sous X. La mère à deux mois pour revenir sur sa décision...ou pas. Les services de l'aide sociale à l'enfance et le service adoption se mettent en mouvement. ,"4,3","4,2",--
Metropolis,19 octobre 2011,Fritz Lang,2h 33min,"Science Fiction,Thriller","Brigitte Helm,Alfred Abel,Rudolf Klein-Rogge",Des ouvriers travaillent dans les souterrains d'une fabuleuse métropole de l'an 2026. Ils assurent le bonheur des nantis qui vivent dans les jardins suspendus de la ville. Un androïde mène les ouvriers vers la révolte.,"4,8","4,2",--
Qu'est-il arrivé à Baby Jane ?,,Robert Aldrich,2h 14min,"Drame,Thriller","Bette Davis,Joan Crawford,Victor Buono","Jane, actrice de second plan, envie la gloire de sa soeur, Blanche, star du grand écran. Quelques années plus tard, Jane aigrie et usée terrorise et sequestre Blanche dont la carrière a été stoppée par une infirmité.",,"4,2",
Old Boy,,Park Chan-Wook,"1h 59min
 ","Action,Drame,Thriller","Choi Min-sik,Yoo Ji-tae,Kang Hye-Jeong","Fin des années 80. Un père de famille est enlevé sans raison et séquestré dans une cellule. Il apprend par la télévision de sa cellule qu'il est accusé du meurtre de sa femme. Relâché 15 ans plus tard, il est contacté par celui qui l'avait enlevé.","4,0","4,2",--
Mademoiselle,,,2h 31min,"Drame,Romance","Kim Min-Hee,Tae-ri Kim,Jung-woo Ha","Corée. Années 30, pendant la colonisation japonaise. Une jeune femme est engagée comme servante d’une riche japonaise, vivant recluse dans un immense manoir sous la coupe d’un oncle tyrannique. Mais Sookee a un secret.","3,8","4,2",--
Love Exposure,,Sion Sono,3h 57min,"Action,Comédie,Drame","Makiko Watanabe,Itsuji Itao,Takahiro Nishijima","Fils d’un prêtre respecté, Yu intègre un groupe de pervers professionnels afin de vivre dans le péché. Malgré une vie de débauche, le jeune homme ne désespère pas de trouver l’âme soeur.",,"4,2",
La Belle équipe,6 avril 2016,Julien Duvivier,1h 35min,Comédie dramatique,"Jean Gabin,Charles Vanel,Raymond Aimos","Cinq ouvriers chômeurs parisiens, Jean, Charles, Raymond, Jacques et Mario, un étranger menacé d'expulsion, gagnent le gros lot de la loterie nationale. Jean a l'idée de placer cet argent en commun, dans l'achat d'un vieux lavoir de banlieue en ruine, qu'ils transformeront en riante guinguette...",,"4,2",
Le Dîner de cons,,Francis Veber,1h 20min,Comédie,"Thierry Lhermitte,Jacques Villeret,Francis Huster","Tous les mercredis, Pierre Brochant et ses amis organisent un dîner où chacun doit amener un con. Celui qui a trouvé le plus spectaculaire est declaré vainqueur. Ce soir, Brochant exulte, il est sur d'avoir trouvé la perle rare, un con de classe mondiale: Francois Pignon, comptable au ministère des Finances et passionné de modèles réduits ...",,"4,2",
Le Loup de Wall Street,,Martin Scorsese,2h 59min,"Biopic,Drame","Leonardo DiCaprio,Jonah Hill,Margot Robbie","L’argent. Le pouvoir. Les femmes. La drogue. Les tentations étaient là, à portée de main, et les autorités n’avaient aucune prise. Aux yeux de Jordan et de sa meute, la modestie était devenue complètement inutile. Trop n’était jamais assez…","4,0","4,2",--
Mystic River,,Clint Eastwood,2h 17min,"Policier,Drame,Thriller","Tim Robbins,Kevin Bacon,Laurence Fishburne","Trois amis d'enfance se perdent de vue. 25 ans plus tard, une affaire de meurtre les réunit à nouveau. La fille de Jimmy est retrouvée assassinée. Le père endeuillé rêve de se venger et Sean, affecté à l'enquête, croit connaître le coupable...","4,7","4,2",--
Brève Rencontre,6 juillet 2011,David Lean,1h 26min,"Drame,Romance","Celia Johnson,Trevor Howard,Cyril Raymond","Dans le café-buffet de la gare de Milford, un homme et une femme se disent adieu. Troublée par l’arrivée fortuite d’une amie encombrante, Laura, la femme, fait un malaise au moment où l’homme la quitte pour prendre son train.",,"4,2",
Ready Player One,,Steven Spielberg,2h 20min,"Action,Science Fiction","Tye Sheridan,Olivia Cooke,Ben Mendelsohn","2045. Le monde est au bord du chaos. Les êtres humains se réfugient dans l'OASIS, univers virtuel mis au point par le brillant et excentrique James Halliday. Avant de disparaître, celui-ci a décidé de léguer son immense fortune à quiconque découvrira l'œuf de Pâques numérique qu'il a pris soin de dissimuler dans l'OASIS.","4,0","4,2",--
Les Forbans de la nuit,26 octobre 2005,Jules Dassin,1h 35min,"Policier,Drame","Richard Widmark,Gene Tierney,Googie Withers",Londres. Un petit escroc veut organiser de grands combats de catch. Il se heurte au chef de gang qui a un contrôle absolu sur ces manifestations. C'est alors une course folle dans les bas-fonds de Londres.,,"4,2",
L'Aventure de Mme Muir,22 octobre 2014,Joseph L. Mankiewicz,1h 44min,"Drame,Fantastique,Romance","Rex Harrison,George Sanders","Au début du siècle, Lucy Muir achète une étrange maison sur la côte anglaise. Etrange en effet, car la demeure est occupée par son ancien propriétaire, le capitaine Gregg. Enfin, par son fantôme...","5,0","4,2",--
Patients,, Grand Corps Malade,1h 52min,"Comédie,Drame","Pablo Pauly,Soufiane Guerrab,Moussa Mansaly","Se laver, s'habiller, marcher, jouer au basket, voici ce que Ben ne peut plus faire à son arrivée dans un centre de rééducation suite à un grave accident. Ses nouveaux amis sont tétras, paras, traumas crâniens.... ","3,8","4,2",--
Hasta la vista,,Geoffrey Enthoven,1h 53min,Comédie dramatique,"Robrecht Vanden Thoren,Johan Heldenbergh,Gilles De Schrijver","Trois jeunes handicapés physiques d’une vingtaine d’années aiment le vin et les femmes, mais ils sont encore vierges. Sous prétexte d’une route des vins, ils embarquent pour un voyage en Espagne dans l’espoir d’avoir leur première expérience sexuelle.","3,5","4,2",--
L'école du bout du monde,,Pawo Choyning Dorji,1h 49min,"Aventure,Drame,Famille","Sherab Dorji,Ugyen Norbu Lhendup,Kelden Lhamo Gurung","Un jeune instituteur du Bhoutan est envoyé dans la partie la plus reculée du pays. Loin de la ville, le quotidien est rude, mais la force spirituelle des habitants du village transformera son destin.","3,5","4,2",--
Le Gouffre aux chimères,15 février 2017,Billy Wilder,1h 51min,Drame,"Kirk Douglas,Jan Sterling,Porter Hall","Charles Tatum, journaliste sans scrupules, va exploiter un scoop. Au Nouveau-Mexique, Léo Minosa, un Indien, est coincé au fond d'une galerie effondrée. S'arrangeant pour être le seul journaliste sur le coup, Tatum va persuader le shérif de choisir la formule de sauvetage la plus lente.","4,3","4,2",--
Chaînes conjugales,7 décembre 2016,Joseph L. Mankiewicz,1h 43min,Comédie dramatique,"Jeanne Crain,Linda Darnell,Ann Sothern","Deborah Bishop, Rita Phipps et Laura May Hollingsway partent en croisière laissant leurs maris respectifs. Mais avant de partir, elles reçoivent une lettre d'une de leur amie commune, Addie Ross, dans laquelle elle prévient qu'elle part avec le mari de l'une d'entre elles. Mais lequel ?","5,0","4,2",--
Pride,,Matthew Warchus,2h 00min,"Comédie,Drame","Bill Nighy,Imelda Staunton,Paddy Considine","Eté 1984 - Margaret Thatcher est au pouvoir et l’Union Nationale des Mineurs est en grève. Lors de la Gay Pride à Londres, un groupe d’activistes gay et lesbien décide de récolter de l’argent pour venir en aide aux familles des mineurs en grève.","3,7","4,2",--
Le Roman de Mildred Pierce,17 mai 2006,Michael Curtiz,1h 51min,"Policier,Drame","Joan Crawford,Jack Carson,Zachary Scott","Mildred Pierce est interrogée par la police après la mort de son second mari. Elle revient alors sur sa vie, de son premier mariage à ses efforts pour satisfaire les besoins de sa fille.","4,5","4,2",--
The Grand Budapest Hotel,,Wes Anderson,1h 40min,"Comédie,Drame","Ralph Fiennes,Tony Revolori,F. Murray Abraham","Le film retrace les aventures de Gustave H, l’homme aux clés d’or d’un célèbre hôtel européen de l’entre-deux-guerres et du garçon d’étage Zéro Moustafa, son allié le plus fidèle.","4,5","4,2",--
La Garçonnière,16 janvier 2019,,2h 05min,"Comédie dramatique,Romance","Jack Lemmon,Shirley MacLaine,Fred MacMurray","C.C. Baxter est employé à la Sauvegarde, grande compagnie d'assurance. Dans l'espoir d'un avancement il prête souvent son appartement à ses supérieurs qui y emmènent leurs petites amies. Un jour le chef du personnel le convoque et lui apprend qu'il sait tout...","3,9","4,2",--
La Trilogie Marseillaise de Marcel Pagnol : Marius,10 juillet 2019,Alexander Korda,2h 10min,"Comédie,Comédie dramatique,Romance"," Raimu,Pierre Fresnay,Fernand Charpin","Marseille – Le bar de la Marine – Marius est un jeune homme que la mer exalte. Il aime son père César, bourru et bonhomme, il aime aussi la petite Fanny qui vend des coquillages devant le bar de César. Depuis son enfance, l’envie de courir le monde l’enflamme. ",,"4,2",
Au nom du père,,Jim Sheridan,2h 13min,Drame,"Daniel Day-Lewis,Pete Postlethwaite,Emma Thompson","En 1975, Gerry Conlon, jeune délinquant originaire de Belfast, est arrêté par la police londonienne qui l'accuse d'être l'instigateur des attentats terroristes à Guildford pour le compte de l'IRA.","3,6","4,2",--
Les Indestructibles 2,,Brad Bird,1h 58min,"Aventure,Animation,Famille","Gérard Lanvin,Craig T. Nelson,Déborah Perret","La suite des aventures de la famille Indestructibles. Alors qu'Hélène (Elastic Girl) prend la tête de la mission ""sauver le monde"", Bob (Mr Indestructible) se retrouve en dehors de sa zone de confort à devoir gérer de manière chaotique les tâches de la vie quotidienne.","4,2","4,2",--
Dragons 2,,Dean DeBlois,1h 43min,"Aventure,Animation,Famille","Donald Reignoux,Jay Baruchel,Cate Blanchett","Ce film est présenté hors-compétition au Festival de Cannes 2014.Tandis qu’Astrid, Rustik le Morveux et le reste de la bande se défient durant des courses sportives de dragons devenues populaires sur l’île, notre duo désormais inséparable parcourt les cieux, à la découverte de territoires inconnus et de nouveaux mondes.","4,0","4,2",--
American Beauty,,Sam Mendes,2h 02min,Drame,"Kevin Spacey,Annette Bening,Thora Birch","Une maison de rêve, un pavillon bourgeois discrètement cossu dissimule dans une banlieue résidentielle, c'est ici que résident Lester Burnhamm, sa femme Carolyn et leur fille Jane. L'agitation du monde et sa violence semblent bien loin ici. Mais derrière cette respectable façade se tisse une étrange et grinçante tragi-comédie familiale ou ...","3,9","4,2",--
"3 Billboards, Les Panneaux de la vengeance",,Martin McDonagh,1h 56min,Drame,"Frances McDormand,Woody Harrelson,Sam Rockwell","Après des mois sans que l'enquête sur la mort de sa fille ait avancé, Mildred Hayes prend les choses en main, affichant un message controversé visant le très respecté chef de la police sur trois grands panneaux à l'entrée de leur ville.","3,9","4,2",--
L'Etrange Noël de M. Jack,,Henry Selick,1h 15min,"Animation,Fantastique,Comédie musicale","Chris Sarandon,Danny Elfman,Catherine O'Hara","Voici l'histoire de Jack Skellington, le roi des citrouilles de la ville Halloween, qui découvre un beau jour la ville de Noël et décide de célébrer lui-même cette fête étrange.","4,8","4,2",--
La Cité de Dieu,,Kátia Lund,2h 15min,"Policier,Drame","Alexandre Rodrigues,Leandro Firmino da Hora,Seu Jorge","Dans une favela de Rio de Janeiro, dans les années 60, Fusée, un gamin noir et pauvre, rêve de devenir photographe professionnel. Petit Dé, un enfant de 11 ans, emménage dans la Cité. Il souhaite pour sa part devenir le plus grand criminel de Rio...","3,9","4,2",--
Loulou,30 octobre 2019,Georg Wilhelm Pabst,2h 13min,Drame,"Louise Brooks,Fritz Kortner,Franz Lederer","Loulou, belle, capricieuse, insouciante et innocemment perverse, est une créature qui ne vit que pour l'amour. Elle joue dans une revue que commandite son amant, Ludwig Schön, un puissant magnat de la presse et du music-hall...",,,
Le Septieme Juré,,Georges Lautner,1h 36min,Drame,"Jacques Monod,Maurice Biraud,Bernard Blier","Un pharmacien etrangle une femme dans un bois. Alors qu'un innocent est accuse, le coupable se retrouve juré au proces de son propre crime.",,"4,2",
Haute pègre,23 janvier 2019,Ernst Lubitsch,1h 23min,Comédie,"Miriam Hopkins,Kay Francis,Herbert Marshall","Gaston et Lilly, deux escrocs tombés amoureux, décident de s’associer. Alors que l’Europe entière parle de leurs méfaits, ils jettent leur dévolu sur une nouvelle victime, la riche et belle Mariette Collet. Mais Gaston va vite tomber sous son charme…","4,5","4,2",--
Mary et Max.,,Adam Elliot,1h 32min,"Animation,Comédie","Toni Collette,Philip Seymour Hoffman,Eric Bana","L'amitié entre une petite fille grassouillette de 8 ans et un homme de 44 ans, obèse, atteint de la maldie d'Asperger. Tous deux vivent respectivement à Melbourne et New York.","4,3","4,2",--
Nous trois ou rien,, Kheiron,1h 42min,Comédie dramatique,"Leïla Bekhti,Gérard Darmon","D’un petit village du sud de l’Iran aux cités parisiennes, Kheiron nous raconte le destin hors du commun de ses parents Hibat et Fereshteh, éternels optimistes, dans une comédie aux airs de conte universel qui évoque l’amour familial, le don de soi et surtout l’idéal d’un vivre-ensemble.","3,6","4,2",--
New York-Miami,4 février 2015,Frank Capra,1h 45min,"Comédie,Romance","Ward Bond,Blanche Friderici,Clark Gable","Ellie fuit son père millionnaire et décide de rallier New York. Elle rencontre Pete, un journaliste, dans le bus, qui comprend très vite qui elle est, son père ayant promis une récompense à qui la lui ramènerait...","4,7","4,2",--
Piège de cristal,3 septembre 2014,John McTiernan,2h 12min,Action,"Bruce Willis,Alan Rickman,Alexander Godunov","Des terroristes investissent le siège social d'une multinationale à Los Angeles. Holly, l'ex-femme de John McClane, policier new-yorkais venu sur la côte Ouest pour Noël, est prise en otage. McLane, enfermé dans le bâtiment, passe à l'action...","3,6","4,2",--
L'Île aux chiens,,Wes Anderson,1h 42min,"Aventure,Animation","Vincent Lindon,Bryan Cranston,Louis Garrel","En raison d’une épidémie de grippe canine, le maire de Megasaki ordonne la mise en quarantaine de tous les chiens de la ville, envoyés sur une île qui devient alors l’Ile aux Chiens. Le jeune Atari, 12 ans, vole un avion et se rend sur l’île pour rechercher son fidèle compagnon, Spots. Aidé par une bande de cinq chiens intrépides et attachants, il découvre une conspiration qui menace la ville.","4,1","4,2",--
Le Salaire de la Peur,8 novembre 2017,Henri-Georges Clouzot,2h 31min,"Aventure,Thriller","Yves Montand,Charles Vanel,Peter van Eyck","Quatre hommes acceptent de véhiculer, au péril de leur vie, un chargement de nitroglycérine sur cinq cents kilomètres de routes défoncées. L'énorme prime de ce ""quitte ou double"" périlleux est le seul moyen de quitter le village d'Amérique centrale dans lequel ils ont échoué.",,"4,2",
Harry Potter et les reliques de la mort - partie 2,,David Yates,2h 10min,"Aventure,Fantastique","Daniel Radcliffe,Rupert Grint,Emma Watson","Dans la 2e Partie de cet épisode final, le combat entre les puissances du bien et du mal de l’univers des sorciers se transforme en guerre sans merci. Les enjeux n’ont jamais été si considérables et personne n’est en sécurité.","3,8","4,2",--
Nausicaä de la vallée du vent,,Hayao Miyazaki,1h 57min,"Aventure,Animation","Gorô Naya,Ichirô Nagai,Mîna Tominaga","Confrontée à la disparition des ressources naturelles de sa planète, la princesse guerrière Nausicaä rassemble son peuple contre l'armée destructrice d'une reine infâme.","4,5","4,2",--
